{
  "schemaVersion": 1,
  "opportunity": "WORKFLOW-DEMO",
  "product": "ExampleFlow Enterprise 4.2",
  "baseline": "RFP revision 1 plus Amendments 1 and 2",
  "revision": "1",
  "owner": "Proposal owner",
  "asOf": "2026-10-02T09:00:00-07:00",
  "deadline": "2026-10-09T17:00:00+02:00",
  "deliveryFormat": "Buyer DOCX template not supplied; Markdown is a private review format only",
  "formatComplete": false,
  "amendments": [
    {
      "id": "A1",
      "changes": "Q8 requires Security Overview revision 3, replacing revision 2."
    },
    {
      "id": "A2",
      "changes": "Q3 EU-only hosting is now mandatory, not preferred, for application data, backups and logs. Prior preference review cannot carry forward."
    }
  ],
  "questions": [
    {
      "id": "Q1",
      "prompt": "Describe intake, approval routing, and visibility for procurement requests.",
      "parts": [
        "intake",
        "routing",
        "visibility"
      ],
      "mandatory": false,
      "maxWords": 80,
      "values": [],
      "amendmentIds": [],
      "attachmentIds": []
    },
    {
      "id": "Q2",
      "prompt": "Do you support SAML 2.0 SSO? State edition and setup owner.",
      "parts": [
        "support",
        "edition",
        "setup-owner"
      ],
      "mandatory": true,
      "maxWords": 50,
      "values": [
        "Yes",
        "No",
        "Partial"
      ],
      "amendmentIds": [],
      "attachmentIds": []
    },
    {
      "id": "Q3",
      "prompt": "Can application data, backups, and logs remain exclusively in the EU? Explain regions.",
      "parts": [
        "application-data",
        "backups",
        "logs",
        "regions"
      ],
      "mandatory": true,
      "maxWords": 60,
      "values": [
        "Yes",
        "No",
        "Partial"
      ],
      "amendmentIds": [
        "A2"
      ],
      "attachmentIds": []
    },
    {
      "id": "Q4",
      "prompt": "Describe export formats, who can export, and whether uploaded attachments are included.",
      "parts": [
        "formats",
        "roles",
        "attachments"
      ],
      "mandatory": false,
      "maxWords": 60,
      "values": [],
      "amendmentIds": [],
      "attachmentIds": []
    },
    {
      "id": "Q5",
      "prompt": "Will you commit to 99.9% monthly availability and service credits? Give approved terms or state pending review.",
      "parts": [
        "availability",
        "credits"
      ],
      "mandatory": true,
      "maxWords": 50,
      "values": [],
      "amendmentIds": [],
      "attachmentIds": []
    },
    {
      "id": "Q6",
      "prompt": "Provide one named reference customer and permission to contact them, or state none is authorized.",
      "parts": [
        "customer",
        "contact-permission"
      ],
      "mandatory": false,
      "maxWords": 40,
      "values": [],
      "amendmentIds": [],
      "attachmentIds": []
    },
    {
      "id": "Q7",
      "prompt": "Describe implementation activities and commit to a go-live date, or state the date is unconfirmed.",
      "parts": [
        "activities",
        "date"
      ],
      "mandatory": false,
      "maxWords": 70,
      "values": [],
      "amendmentIds": [],
      "attachmentIds": []
    },
    {
      "id": "Q8",
      "prompt": "List Security Overview revision 3 and data-processing agreement revision 5 attachments, or identify each as not supplied.",
      "parts": [
        "security-overview",
        "data-processing-agreement"
      ],
      "mandatory": true,
      "maxWords": 50,
      "values": [],
      "amendmentIds": [
        "A1"
      ],
      "attachmentIds": [
        "SECURITY",
        "DPA"
      ]
    }
  ],
  "sources": [
    {
      "id": "PRODUCT-4.2",
      "version": "4.2",
      "product": "ExampleFlow Enterprise 4.2",
      "audience": "buyer-permitted",
      "current": true,
      "claims": [
        {
          "id": "forms",
          "text": "Configurable request forms are supported.",
          "questionIds": [
            "Q1"
          ]
        },
        {
          "id": "routing",
          "text": "Sequential approval routing is supported.",
          "questionIds": [
            "Q1"
          ]
        },
        {
          "id": "visibility",
          "text": "Status view shows current step and assigned approver.",
          "questionIds": [
            "Q1"
          ]
        },
        {
          "id": "sso",
          "text": "Enterprise 4.2 supports SAML 2.0 SSO.",
          "questionIds": [
            "Q2"
          ]
        },
        {
          "id": "sso-owners",
          "text": "Customer identity administrator configures the identity provider; workspace administrator configures ExampleFlow.",
          "questionIds": [
            "Q2"
          ]
        },
        {
          "id": "exports",
          "text": "Workspace administrators can export request records as CSV; uploaded attachments are excluded.",
          "questionIds": [
            "Q4"
          ]
        }
      ]
    },
    {
      "id": "REGIONS-2026-10",
      "version": "2026-10",
      "product": "ExampleFlow Enterprise 4.2",
      "audience": "buyer-permitted",
      "current": true,
      "claims": [
        {
          "id": "regions",
          "text": "Application data, backups and logs are hosted only in the US. EU hosting is unavailable; no approved EU release date.",
          "questionIds": [
            "Q3"
          ]
        }
      ]
    },
    {
      "id": "DELIVERY-2",
      "version": "2",
      "product": "ExampleFlow Enterprise 4.2",
      "audience": "buyer-permitted",
      "current": true,
      "claims": [
        {
          "id": "activities",
          "text": "Implementation includes discovery, form configuration, SSO setup, user acceptance testing and administrator training. Timing depends on scope, identity-provider access and capacity. No date is approved for this opportunity.",
          "questionIds": [
            "Q7"
          ]
        }
      ]
    },
    {
      "id": "LIBRARY-2025",
      "version": "2025-06",
      "product": "Unspecified historical product",
      "audience": "internal-only",
      "current": false,
      "claims": [
        {
          "id": "old-region",
          "text": "Historical answer says EU hosting available; not current evidence.",
          "questionIds": [
            "Q3"
          ]
        },
        {
          "id": "old-sla",
          "text": "Historical 99.9% and service-credit text; no scoped approval supplied.",
          "questionIds": [
            "Q5"
          ]
        }
      ]
    }
  ],
  "summary": {
    "text": "ExampleFlow Enterprise 4.2 supports configurable procurement request forms, sequential approvals, SAML 2.0 SSO, and administrator CSV export of request records. It does not meet the mandatory EU-only hosting requirement: application data, backups and logs are hosted in the US only. Availability and service credits remain pending review. No reference is authorized, no go-live date is committed, and both requested attachments are absent. This is a complete question-by-question working draft, not a submission-ready bid.",
    "evidence": [
      {
        "sourceId": "PRODUCT-4.2",
        "claimId": "forms"
      },
      {
        "sourceId": "PRODUCT-4.2",
        "claimId": "routing"
      },
      {
        "sourceId": "PRODUCT-4.2",
        "claimId": "sso"
      },
      {
        "sourceId": "PRODUCT-4.2",
        "claimId": "exports"
      },
      {
        "sourceId": "REGIONS-2026-10",
        "claimId": "regions"
      }
    ]
  },
  "summaryMaxWords": 100,
  "answers": [
    {
      "questionId": "Q1",
      "responseValue": null,
      "parts": [
        {
          "id": "intake",
          "text": "Procurement requests can be collected through configurable forms.",
          "state": "supported",
          "evidence": [
            {
              "sourceId": "PRODUCT-4.2",
              "claimId": "forms"
            }
          ]
        },
        {
          "id": "routing",
          "text": "Requests can follow sequential approval steps.",
          "state": "supported",
          "evidence": [
            {
              "sourceId": "PRODUCT-4.2",
              "claimId": "routing"
            }
          ]
        },
        {
          "id": "visibility",
          "text": "A status view shows the current step and assigned approver.",
          "state": "supported",
          "evidence": [
            {
              "sourceId": "PRODUCT-4.2",
              "claimId": "visibility"
            }
          ]
        }
      ]
    },
    {
      "questionId": "Q2",
      "responseValue": "Yes",
      "parts": [
        {
          "id": "support",
          "text": "SAML 2.0 SSO is supported.",
          "state": "supported",
          "evidence": [
            {
              "sourceId": "PRODUCT-4.2",
              "claimId": "sso"
            }
          ]
        },
        {
          "id": "edition",
          "text": "This answer applies to Enterprise 4.2.",
          "state": "supported",
          "evidence": [
            {
              "sourceId": "PRODUCT-4.2",
              "claimId": "sso"
            }
          ]
        },
        {
          "id": "setup-owner",
          "text": "Your identity administrator configures the identity provider; a workspace administrator configures ExampleFlow.",
          "state": "supported",
          "evidence": [
            {
              "sourceId": "PRODUCT-4.2",
              "claimId": "sso-owners"
            }
          ]
        }
      ]
    },
    {
      "questionId": "Q3",
      "responseValue": "No",
      "parts": [
        {
          "id": "application-data",
          "text": "Application data is hosted in the US only.",
          "state": "gap",
          "evidence": [
            {
              "sourceId": "REGIONS-2026-10",
              "claimId": "regions"
            }